{
  "$schema": "https://json-schema.org/draft/2019-09/schema#",
  "$id": "https://mobiflight.com/blesimionic.schema.json",
  "title": "Simionic BLE Device",
  "description": "Schema for Simionic G1000 Bluetooth LE device configuration",
  "type": "object",
  "required": ["Name", "ServiceUUID", "CharacteristicUUID"],
  "properties": {
    "$schema": {
      "type": "string",
      "description": "Reference to the JSON schema file"
    },
    "Name": {
      "type": "string",
      "description": "Display name for the device"
    },
    "ServiceUUID": {
      "type": "string",
      "description": "Bluetooth LE service UUID"
    },
    "CharacteristicUUID": {
      "type": "string",
      "description": "Bluetooth LE characteristic UUID"
    },
    "Inputs": {
      "type": "array",
      "description": "List of input controls (buttons and encoders)",
      "items": {
        "type": "object",
        "required": ["Type", "Label"],
        "properties": {
          "Type": {
            "type": "string",
            "enum": ["Button", "Encoder"],
            "description": "The input type: Button or Encoder"
          },
          "Label": {
            "type": "string",
            "description": "Display label for the input"
          },
          "Press": {
            "type": "string",
            "pattern": "^[0-9A-Fa-f]{2}$",
            "description": "Hex code sent when button is pressed (Button type only)"
          },
          "Release": {
            "type": "string",
            "pattern": "^[0-9A-Fa-f]{2}$",
            "description": "Hex code sent when button is released (Button type only)"
          },
          "Increment": {
            "type": "string",
            "pattern": "^[0-9A-Fa-f]{2}$",
            "description": "Hex code sent when encoder is turned clockwise (Encoder type only)"
          },
          "Decrement": {
            "type": "string",
            "pattern": "^[0-9A-Fa-f]{2}$",
            "description": "Hex code sent when encoder is turned counter-clockwise (Encoder type only)"
          }
        },
        "additionalProperties": false
      }
    },
    "Outputs": {
      "type": "array",
      "description": "List of output controls (to be confirmed)",
      "items": {
        "type": "object"
      }
    }
  },
  "additionalProperties": false
}
